{
  "version": "query_candidate_planner_cost_cache_latency_evaluation_report_v1",
  "evaluatorVersion": "query_candidate_planner_cost_cache_latency_evaluator_v1",
  "decision": "EVALUATION_BLOCKED",
  "failClosed": true,
  "validationErrors": [],
  "dataset": {
    "datasetId": "beebeeai_query_candidate_cost_cache_latency_core_v1",
    "datasetSha256": "9f9d09a0cd19b05b13800cebb00869bacb46e49068c63ac775c38a69aebc6f1d",
    "benchmarkMode": "CANONICAL_BENCHMARK_WITH_APPROVED_ACTUAL_PRICING_AND_COST_CONSISTENCY",
    "executionCount": 25,
    "lifecycleEventCount": 15
  },
  "policies": {
    "thresholdPolicyId": "beebeeai_query_candidate_operational_thresholds_v1",
    "thresholdPolicySha256": "6167dfbce0e3498efcea0890d2442a167d2e23f903783e9d2905d89a6beeedf7",
    "pricingPolicyId": "openai_gpt_5_6_terra_standard_2026_07_30_v1",
    "pricingPolicySha256": "6e7e6100e44f250fa31ac180bf7af7400aba635ca2c1fe7d0946feb08be4eb52",
    "pricingMode": "APPROVED_ACTUAL",
    "currency": "USD"
  },
  "sample": {
    "executions": 25,
    "successfulExecutions": 25,
    "coldExecutions": 5,
    "warmExecutions": 15,
    "downloadReuseExecutions": 5,
    "reuploadExecutions": 5,
    "lifecycleEvents": 15
  },
  "metrics": {
    "cost": {
      "currency": "USD",
      "totalMicrousd": 48900,
      "averagePerExecutionMicrousd": 1956,
      "averagePerProviderCallMicrousd": 4890,
      "warmAverageMicrousd": 0,
      "p95PerExecutionMicrousd": 5280,
      "avoidedByCacheMicrousd": 72600,
      "cacheCostAvoidanceRate": 0.597531,
      "monthlyProjectionExecutions": 10000,
      "monthlyProjectedCostMicrousd": 19560000,
      "sourceBreakdown": {
        "observedCostCount": 0,
        "tokenPricingPolicyCount": 10,
        "noProviderCallCount": 15
      }
    },
    "cache": {
      "eligibleReadCount": 25,
      "hitCount": 15,
      "missCount": 10,
      "hitRate": 0.6,
      "warmHitRate": 1,
      "downloadReuseHitRate": 1,
      "levelCounts": {
        "L1": 2,
        "L2": 1,
        "L3": 4,
        "L4": 8
      },
      "levelRates": {
        "L1": 0.133333,
        "L2": 0.066667,
        "L3": 0.266667,
        "L4": 0.533333
      }
    },
    "provider": {
      "callCount": 10,
      "callRate": 0.4,
      "warmCallRate": 0,
      "reuploadCallRate": 1,
      "inputTokens": 11100,
      "outputTokens": 2225
    },
    "latency": {
      "overall": {
        "sampleCount": 25,
        "averageMs": 492.2,
        "p50Ms": 88,
        "p95Ms": 1240,
        "p99Ms": 1295,
        "maxMs": 1295
      },
      "cold": {
        "sampleCount": 5,
        "averageMs": 1060,
        "p50Ms": 1060,
        "p95Ms": 1180,
        "p99Ms": 1180,
        "maxMs": 1180
      },
      "warm": {
        "sampleCount": 15,
        "averageMs": 72,
        "p50Ms": 72,
        "p95Ms": 94,
        "p99Ms": 94,
        "maxMs": 94
      },
      "cacheHit": {
        "sampleCount": 15,
        "averageMs": 72,
        "p50Ms": 72,
        "p95Ms": 94,
        "p99Ms": 94,
        "maxMs": 94
      },
      "reupload": {
        "sampleCount": 5,
        "averageMs": 1185,
        "p50Ms": 1185,
        "p95Ms": 1295,
        "p99Ms": 1295,
        "maxMs": 1295
      }
    },
    "reliability": {
      "successRate": 1,
      "timeoutCount": 0,
      "timeoutRate": 0,
      "errorCount": 0,
      "errorRate": 0
    },
    "lifecycle": {
      "downloadEventCount": 5,
      "deleteEventCount": 5,
      "reuploadEventCount": 5,
      "downloadRetentionAccuracy": 1,
      "deleteInvalidationCoverage": 1,
      "reuploadIdentitySeparationAccuracy": 1,
      "staleCacheReuseViolationCount": 0
    }
  },
  "thresholdResults": [
    {
      "metric": "sample.executions",
      "operator": ">=",
      "actual": 25,
      "threshold": 25,
      "passed": true
    },
    {
      "metric": "sample.coldExecutions",
      "operator": ">=",
      "actual": 5,
      "threshold": 5,
      "passed": true
    },
    {
      "metric": "sample.warmExecutions",
      "operator": ">=",
      "actual": 15,
      "threshold": 15,
      "passed": true
    },
    {
      "metric": "sample.lifecycleEvents",
      "operator": ">=",
      "actual": 15,
      "threshold": 15,
      "passed": true
    },
    {
      "metric": "cache.hitRate",
      "operator": ">=",
      "actual": 0.6,
      "threshold": 0.6,
      "passed": true
    },
    {
      "metric": "cache.warmHitRate",
      "operator": ">=",
      "actual": 1,
      "threshold": 1,
      "passed": true
    },
    {
      "metric": "cache.downloadReuseHitRate",
      "operator": ">=",
      "actual": 1,
      "threshold": 1,
      "passed": true
    },
    {
      "metric": "provider.callRate",
      "operator": "<=",
      "actual": 0.4,
      "threshold": 0.4,
      "passed": true
    },
    {
      "metric": "provider.warmCallRate",
      "operator": "<=",
      "actual": 0,
      "threshold": 0,
      "passed": true
    },
    {
      "metric": "provider.reuploadCallRate",
      "operator": ">=",
      "actual": 1,
      "threshold": 1,
      "passed": true
    },
    {
      "metric": "latency.overall.p95Ms",
      "operator": "<=",
      "actual": 1240,
      "threshold": 1400,
      "passed": true
    },
    {
      "metric": "latency.overall.p99Ms",
      "operator": "<=",
      "actual": 1295,
      "threshold": 1500,
      "passed": true
    },
    {
      "metric": "latency.warm.p95Ms",
      "operator": "<=",
      "actual": 94,
      "threshold": 120,
      "passed": true
    },
    {
      "metric": "latency.cacheHit.p95Ms",
      "operator": "<=",
      "actual": 94,
      "threshold": 120,
      "passed": true
    },
    {
      "metric": "reliability.timeoutRate",
      "operator": "<=",
      "actual": 0,
      "threshold": 0,
      "passed": true
    },
    {
      "metric": "reliability.errorRate",
      "operator": "<=",
      "actual": 0,
      "threshold": 0,
      "passed": true
    },
    {
      "metric": "cost.averagePerExecutionMicrousd",
      "operator": "<=",
      "actual": 1956,
      "threshold": 130,
      "passed": false
    },
    {
      "metric": "cost.averagePerProviderCallMicrousd",
      "operator": "<=",
      "actual": 4890,
      "threshold": 325,
      "passed": false
    },
    {
      "metric": "cost.warmAverageMicrousd",
      "operator": "<=",
      "actual": 0,
      "threshold": 0,
      "passed": true
    },
    {
      "metric": "cost.monthlyProjectedCostMicrousd",
      "operator": "<=",
      "actual": 19560000,
      "threshold": 1300000,
      "passed": false
    },
    {
      "metric": "cost.cacheCostAvoidanceRate",
      "operator": ">=",
      "actual": 0.597531,
      "threshold": 0.59,
      "passed": true
    },
    {
      "metric": "lifecycle.deleteInvalidationCoverage",
      "operator": ">=",
      "actual": 1,
      "threshold": 1,
      "passed": true
    },
    {
      "metric": "lifecycle.downloadRetentionAccuracy",
      "operator": ">=",
      "actual": 1,
      "threshold": 1,
      "passed": true
    },
    {
      "metric": "lifecycle.reuploadIdentitySeparationAccuracy",
      "operator": ">=",
      "actual": 1,
      "threshold": 1,
      "passed": true
    },
    {
      "metric": "lifecycle.staleCacheReuseViolationCount",
      "operator": "<=",
      "actual": 0,
      "threshold": 0,
      "passed": true
    }
  ],
  "failedThresholds": [
    "cost.averagePerExecutionMicrousd",
    "cost.averagePerProviderCallMicrousd",
    "cost.monthlyProjectedCostMicrousd"
  ],
  "privacy": {
    "rawRowsIncluded": false,
    "rawFileNamesIncluded": false,
    "userIdentityIncluded": false,
    "storageKeysIncluded": false,
    "cacheSecretsIncluded": false
  },
  "guardrails": {
    "evaluationOnly": true,
    "routeWired": false,
    "controllerWired": false,
    "providerCallsExecutedByEvaluator": 0,
    "pricingPolicyIsInvoice": false,
    "promotionAuthorized": false,
    "productionCandidateMergeApplied": false,
    "productionReadyAssignment": false,
    "railwayEnvironmentChanged": false
  }
}
